{
  "updated_at": "2026-08-11T12:00:00.000Z",
  "callsign": "NEPHELIS.MCC",
  "phase": "PRE-HARDWARE",
  "launch_target": "uncommitted — earliest class ~2030–2031+ if gates pass",
  "funding_goal_usd": 500000,
  "funding_goal_label": "Ground demonstrator / early R&D campaign (not full flight cost)",
  "checklist": [
    {
      "id": "mc-github-ssot",
      "item": "GitHub ehreng/Nephelis as single source of truth with open L1–L3 issues",
      "phase": "PROGRAM",
      "status": "in_progress",
      "due": "2026-Q3"
    },
    {
      "id": "mc-status-page",
      "item": "Keep /status and progress.json current with built vs not-yet",
      "phase": "PROGRAM",
      "status": "in_progress",
      "due": "2026-Q3"
    },
    {
      "id": "mc-requirements",
      "item": "Mission requirements baseline (v0.9 draft exists — keep honest about incompleteness)",
      "phase": "DESIGN",
      "status": "in_progress",
      "due": "2026-Q4"
    },
    {
      "id": "mc-conops",
      "item": "CONOPS updated for ground-first program (flight dates aspirational)",
      "phase": "DESIGN",
      "status": "planned",
      "due": "2026-Q4"
    },
    {
      "id": "mc-materials-test",
      "item": "Acid / materials coupon campaign started (first coupons + log photos)",
      "phase": "GROUND",
      "status": "planned",
      "due": "2027-H1"
    },
    {
      "id": "mc-he-float",
      "item": "Small helium ground float prototype with basic telemetry",
      "phase": "GROUND",
      "status": "planned",
      "due": "2027"
    },
    {
      "id": "mc-regulatory-notes",
      "item": "Regulatory path notes (FAA/FCC/export) drafted publicly",
      "phase": "PROGRAM",
      "status": "in_progress",
      "due": "2026-Q4"
    },
    {
      "id": "mc-funding-rails",
      "item": "Live payment rails OR honest “not open yet” state (no fake allocation)",
      "phase": "PROGRAM",
      "status": "planned",
      "due": "2026-Q4"
    },
    {
      "id": "mc-funding-50",
      "item": "50% of $500k ground-campaign goal committed (if fundraising opens)",
      "phase": "PROGRAM",
      "status": "planned",
      "due": "2027+"
    },
    {
      "id": "mc-flight-gate",
      "item": "Flight program gate: only after ground demonstrator success + credible capital plan",
      "phase": "FLIGHT-GATE",
      "status": "planned",
      "due": "2028+"
    }
  ]
}
